{
  "$schema": "./public-api.schema.json",
  "schemaVersion": 1,
  "version": "2.2.0",
  "status": "stable",
  "cssVersion": "2.2.0",
  "angularjs": ">=1.8.2 <1.9.0",
  "components": 575,
  "behaviors": 96,
  "componentExports": [
    "GButtonDirective",
    "GButtonGroupDirective",
    "GCardDirective",
    "GBadgeDirective",
    "GTagDirective",
    "GChipDirective",
    "GBadgeTagChipDirective",
    "GAvatarDirective",
    "GAvatarGroupDirective",
    "GAlertDirective",
    "GProgressMeterDirective",
    "GSpinnerSkeletonDirective",
    "GEmptyStateDirective",
    "GInputDirective",
    "GTextareaDirective",
    "GSelectDirective",
    "GCheckboxRadioDirective",
    "GSwitchDirective",
    "GRangeColorDirective",
    "GFileDropDirective",
    "GComboboxDirective",
    "GFormDirective",
    "GFormSectionDirective",
    "GFieldDirective",
    "GFieldsetDirective",
    "GFormRowDirective",
    "GFormGridDirective",
    "GHorizontalFormDirective",
    "GInlineFormDirective",
    "GCompactFormDirective",
    "GInputGroupDirective",
    "GInputAffixDirective",
    "GSearchFieldDirective",
    "GPasswordFieldDirective",
    "GClearableFieldDirective",
    "GCharacterCounterDirective",
    "GValidationStateDirective",
    "GCheckboxGroupDirective",
    "GRadioGroupDirective",
    "GSwitchRowDirective",
    "GChoiceCardGroupDirective",
    "GNameGroupDirective",
    "GAddressGroupDirective",
    "GPhoneGroupDirective",
    "GMoneyGroupDirective",
    "GDateRangeGroupDirective",
    "GTimeRangeGroupDirective",
    "GUnitFieldDirective",
    "GRangeFieldDirective",
    "GFileFieldDirective",
    "GRepeatableFieldDirective",
    "GConditionalFieldDirective",
    "GFormActionsDirective",
    "GAutosaveStatusDirective",
    "GFormProgressDirective",
    "GFormReviewDirective",
    "GConsentGroupDirective",
    "GNavbarDirective",
    "GSidebarDirective",
    "GBreadcrumbDirective",
    "GTabsDirective",
    "GSegmentedControlDirective",
    "GPaginationDirective",
    "GMenuDropdownDirective",
    "GStepperDirective",
    "GCommandPaletteDirective",
    "GPrimaryNavigationDirective",
    "GUtilityNavigationDirective",
    "GSubNavigationDirective",
    "GCollapsibleNavigationDirective",
    "GNavigationRailDirective",
    "GActivityBarDirective",
    "GMenuBarDirective",
    "GContextMenuDirective",
    "GTreeNavigationDirective",
    "GVerticalTabsDirective",
    "GPillNavigationDirective",
    "GScrollspyNavigationDirective",
    "GCursorPaginationDirective",
    "GLoadMoreNavigationDirective",
    "GWizardNavigationDirective",
    "GBackNavigationDirective",
    "GPreviousNextNavigationDirective",
    "GSkipNavigationDirective",
    "GMobileTopNavigationDirective",
    "GBottomNavigationDirective",
    "GMobileTabBarDirective",
    "GDrawerNavigationDirective",
    "GCommandNavigationDirective",
    "GJumpNavigationDirective",
    "GQuickNavigationDirective",
    "GLocaleNavigationDirective",
    "GAccountNavigationDirective",
    "GDialogDirective",
    "GDrawerDirective",
    "GPopoverDirective",
    "GTooltipDirective",
    "GPopconfirmDirective",
    "GConfirmDialogDirective",
    "GToastDirective",
    "GAccordionDirective",
    "GTableDirective",
    "GDataGridDirective",
    "GKpiStatDirective",
    "GDescriptionListDirective",
    "GDescriptionsDirective",
    "GListDirective",
    "GListGroupDirective",
    "GTreeDirective",
    "GTimelineDirective",
    "GResponsiveTableDirective",
    "GTableSortDirective",
    "GRowSelectionDirective",
    "GRowDisclosureDirective",
    "GColumnToggleDirective",
    "GDataFilterDirective",
    "GDataViewDirective",
    "GEditableGridDirective",
    "GTreeTableDirective",
    "GGroupedTableDirective",
    "GExpandableTableDirective",
    "GComparisonTableDirective",
    "GKeyValueDirective",
    "GRecordDetailDirective",
    "GMediaListDirective",
    "GDenseListDirective",
    "GAuditLogCompositionDirective",
    "GStatListDirective",
    "GMetricCardDirective",
    "GSparklineDirective",
    "GProgressStatsDirective",
    "GDataLegendDirective",
    "GRankingDirective",
    "GStatusSummaryDirective",
    "GDataMatrixDirective",
    "GHeatmapDirective",
    "GDataToolbarDirective",
    "GColumnChooserDirective",
    "GSavedViewsDirective",
    "GExportPanelDirective",
    "GDataStateDirective",
    "GDataViewSwitcherDirective",
    "GSelectionSummaryDirective",
    "GTableDensityDirective",
    "GFilterSummaryDirective",
    "GSortBuilderDirective",
    "GDataInspectorDirective",
    "GSelectionControlsDirective",
    "GBatchToolbarDirective",
    "GDualListDirective",
    "GTreeSelectDirective",
    "GCascaderDirective",
    "GMentionPickerDirective",
    "GUserPickerDirective",
    "GOrganizationPickerDirective",
    "GResourcePickerDirective",
    "GMediaPickerDirective",
    "GIconPickerDirective",
    "GColorPickerCompositionDirective",
    "GDateRangePickerCompositionDirective",
    "GTimeRangePickerCompositionDirective",
    "GSavedFiltersDirective",
    "GGroupBuilderDirective",
    "GEntityPickerDirective",
    "GTagPickerDirective",
    "GRelationPickerDirective",
    "GBulkConfirmationDirective",
    "GBulkProgressDirective",
    "GFilterBarDirective",
    "GCodeBlockDirective",
    "GTerminalDirective",
    "GDiffViewerDirective",
    "GChartContainerDirective",
    "GGridSystemDirective",
    "GRegionLayoutSystemDirective",
    "GClassicLayoutPrimitivesDirective",
    "GPageHeaderDirective",
    "GSectionHeaderDirective",
    "GSubheaderDirective",
    "GToolbarDirective",
    "GActionBarDirective",
    "GStatusBarDirective",
    "GCommandBarDirective",
    "GContextBarDirective",
    "GBulkActionBarDirective",
    "GFooterBarDirective",
    "GFloatingActionBarDirective",
    "GDividerWithTextDirective",
    "GStickyActionsDirective",
    "GPageLoadingDirective",
    "GPageStateSystemDirective",
    "GTipDirective",
    "GInlineHintDirective",
    "GHelpTextDirective",
    "GHelpTriggerDirective",
    "GRichTooltipDirective",
    "GHelpPopoverDirective",
    "GDefinitionHelpDirective",
    "GCalloutDirective",
    "GNoteDirective",
    "GGuidancePairDirective",
    "GKeyHintDirective",
    "GShortcutListDirective",
    "GHelpCardDirective",
    "GHelpPanelDirective",
    "GHelpCenterDirective",
    "GHelpTopicsDirective",
    "GFaqDirective",
    "GContextualHelpDirective",
    "GCoachMarkDirective",
    "GSpotlightDirective",
    "GHotspotDirective",
    "GFeatureHintDirective",
    "GWhatsNewDirective",
    "GHelpChecklistDirective",
    "GTroubleshootingDirective",
    "GHelpFeedbackDirective",
    "GAppShellDirective",
    "GDashboardDirective",
    "GMobileShellDirective",
    "GChatDirective",
    "GMessageDirective",
    "GPromptComposerDirective",
    "GAttachmentDirective",
    "GThinkingDirective",
    "GToolCallDirective",
    "GToolApprovalDirective",
    "GAgentStatusDirective",
    "GAgentPlanDirective",
    "GSourcesCitationsDirective",
    "GArtifactPanelDirective",
    "GModelSelectorDirective",
    "GContextMeterDirective",
    "GVoiceStateDirective",
    "GGenerationPlaceholderDirective",
    "GAiWorkspaceDirective",
    "GPromptStarterDirective",
    "GAiCommandMenuDirective",
    "GStreamingResponseDirective",
    "GMultiAgentBoardDirective",
    "GAgentHandoffDirective",
    "GArtifactWorkspaceDirective",
    "GGenerationGalleryDirective",
    "GAiContextManagerDirective",
    "GAiUsagePanelDirective",
    "GAiSafetyNoticeDirective",
    "GAiFeedbackDirective",
    "GDatePickerDirective",
    "GTimePickerDirective",
    "GPinInputDirective",
    "GRatingDirective",
    "GTransferListDirective",
    "GValidationSummaryDirective",
    "GMegaMenuDirective",
    "GAnchorNavigationDirective",
    "GTourSpotlightDirective",
    "GVirtualListDirective",
    "GKanbanDirective",
    "GGanttShellDirective",
    "GQueryBuilderDirective",
    "GCarouselDirective",
    "GGalleryLightboxDirective",
    "GMediaPlayerDirective",
    "GDocumentViewerDirective",
    "GSplitPaneDirective",
    "GDragSortDirective",
    "GInfiniteScrollDirective",
    "GPullRefreshDirective",
    "GProductCardDirective",
    "GCartItemDirective",
    "GPriceQuantityDirective",
    "GConversationListDirective",
    "GPromptLibraryDirective",
    "GMentionSlashCommandDirective",
    "GGenerationCardDirective",
    "GFileTreeDirective",
    "GVersionHistoryDirective",
    "GPermissionScopeDirective",
    "GCostRateLimitDirective",
    "GPrivacyNoticeDirective",
    "GAuthenticationShellDirective",
    "GMobileCategoryDirective",
    "GCmsShellDirective",
    "GVisualBuilderDirective",
    "GRichEditorDirective",
    "GMediaLibraryDirective",
    "GContentWorkflowDirective",
    "GLocalizationGridDirective",
    "GSiteHeaderDirective",
    "GHeroDirective",
    "GPricingDirective",
    "GArticleLayoutDirective",
    "GProductDetailDirective",
    "GCheckoutDirective",
    "GEnterpriseSettingsDirective",
    "GPermissionMatrixDirective",
    "GAuditLogDirective",
    "GDesktopShellDirective",
    "GDesktopTitlebarDirective",
    "GDesktopWorkbenchDirective",
    "GOnboardingDirective",
    "GWizardLayoutDirective",
    "GNotificationCenterDirective",
    "GInboxDirective",
    "GSearchResultsDirective",
    "GCalendarDirective",
    "GAgendaDirective",
    "GFileManagerDirective",
    "GUploadQueueDirective",
    "GFormBuilderDirective",
    "GFilterBuilderDirective",
    "GPivotTableDirective",
    "GOrganizationChartDirective",
    "GMapShellDirective",
    "GCommentThreadDirective",
    "GActivityFeedDirective",
    "GReportInvoiceDirective",
    "GCookieConsentDirective",
    "GCopyActionDirective",
    "GFullscreenActionDirective",
    "GBackToTopDirective",
    "GImageCropShellDirective",
    "GContentFileDropDirective",
    "GContentFileListDirective",
    "GContentUploadQueueDirective",
    "GChunkUploadDirective",
    "GUploadProgressCompositionDirective",
    "GFailedUploadDirective",
    "GFileCardCompositionDirective",
    "GFolderTreeCompositionDirective",